id,author_id,created_at,text,lang,source,retweet_count,reply_count,like_count,quote_count,hashtags,mentions,urls,possibly_sensitive,conversation_id,reply_settings,context_entities,referenced_tweets,total_reply,total_engage,text_clean,tmpid,Effectiveness_of_GLP1_Agonists,Personal_Experiences_and_Side_Effects,Perceptions_of_Weight_Loss,Food_Industry_Perceptions,Addiction_and_Cravings,Weight_Loss_Journey,Marketing_and_Product_Ideas,Mood_and_Energy,Scientific_Information,Societal_Issues,author_username,author_name,author_description,author_location,author_profile_image,author_protected,author_verified,author_created_at,author_url,author_followers_count,author_following_count,author_tweet_count,author_listed_count
1943747117333336270,356495526,2025-07-11 19:00:00+00:00,"Zepbound (tirzepatide) and Wegovy (semaglutide) are injectable medications for weight loss. Both work on your appetite, hunger, and food cravings, but they achieve this effect in different ways. Learn more: https://t.co/j9Qqw2pCnA",en,,0,0,1,0,[],[],['https://goodrx.co/4kC4Akp'],False,1943747117333336270,everyone,[],[],0.0,1.0,Zepbound (tirzepatide) and Wegovy (semaglutide) are injectable medications for weight loss. Both work on your appetite hunger and food cravings but they achieve this effect in different ways. Learn more,1,True,False,False,False,False,False,False,False,False,False,GoodRx,GoodRx,"Your home for prescription savings + information from the trusted doctors, pharmacists, and journalists of GoodRx Health.
Share your #GoodRx story","Santa Monica, CA",https://pbs.twimg.com/profile_images/1455245365569998849/6I9ECChg_normal.jpg,False,False,2011-08-16 23:09:45+00:00,https://t.co/LDgHiyzqOI,13377.0,1251.0,15230.0,139.0
1943743424563167260,1105515026503421952,2025-07-11 18:45:20+00:00,"Goes to LA and gets on ozempic. It’s so over for the association 
Skinny Luka on the lakers wins 3 chips before he retires @TheyAlreadyKnew https://t.co/gCFlfvm4RV",en,,0,0,0,0,[],['TheyAlreadyKnew'],['https://twitter.com/ludwigahgren/status/1943697791676739808'],False,1943743424563167260,everyone,"['NBA Basketball', 'Los Angeles Lakers', 'NBA', 'Sports & Fitness Business', 'Los Angeles Lakers', 'NBA', 'Basketball', 'Sports', 'Basketball', 'Basketball', 'Sports']",[<ReferencedTweet id=1943697791676739808 type=quoted>],0.0,0.0,Goes to LA and gets on ozempic. Its so over for the association Skinny Luka on the lakers wins 3 chips before he retires @TheyAlreadyKnew,2,False,False,False,False,False,False,False,False,False,False,vikings129,vikings129,Generational Hater™️| Reformed wigger,,https://pbs.twimg.com/profile_images/1450308722723545089/pCYo85Z2_normal.jpg,False,False,2019-03-12 17:04:56+00:00,,178.0,505.0,5631.0,3.0
1943725026160660892,1941462918542786560,2025-07-11 17:32:13+00:00,"Cravings down. Confidence up.
Oh My Meds offers GLP-1 treatments like Tirzepatide and Semaglutide, prescribed online.
Feel better. Eat smarter.
💻 https://t.co/mgcz7kDQ4m
#ohmymedsrx #glp #weightloss #semaglutide #tirzepatide https://t.co/YNKryZMCc9",en,,0,0,0,0,"['ohmymedsrx', 'glp', 'weightloss', 'semaglutide', 'tirzepatide']",[],"['http://join.ohmymeds.com', 'https://x.com/ohmymedsrx/status/1943725026160660892/video/1']",False,1943725026160660892,everyone,"['Sports & Fitness Business', 'Fitness']",[],0.0,0.0,Cravings down. Confidence up. Oh My Meds offers GLP-1 treatments like Tirzepatide and Semaglutide prescribed online. Feel better. Eat smarter.,3,True,False,False,False,False,False,False,False,False,False,ohmymedsrx,OhMyMeds,Low Cost Medication Delivered Nationwide.,"Orlando, Florida",https://pbs.twimg.com/profile_images/1941619577349152769/Qj_syj9u_normal.jpg,False,False,2025-07-05 11:44:34+00:00,,0.0,1.0,20.0,0.0
1943682944037490933,1183757070757220352,2025-07-11 14:45:00+00:00,"Prader-Willi syndrome—a rare genetic disorder marked by insatiable hunger—shows that obesity isn’t one disease, but a spectrum. This breakthrough is a reminder that personalized treatment matters. Learn more @ConscienHealth: https://t.co/amgwwPnCP8",en,,3,0,4,0,[],['ConscienHealth'],['https://conscienhealth.org/2025/06/prader-willi-reminds-us-glp-1-is-not-the-whole-story-of-obesity/'],False,1943682944037490933,everyone,[],[],0.0,7.0,Prader-Willi syndrome—a rare genetic disorder marked by insatiable hunger—shows that obesity isnt one disease but a spectrum. This breakthrough is a reminder that personalized treatment matters. Learn more @ConscienHealth,4,False,False,False,False,False,False,False,False,False,True,ObesityAdvocacy,Obesity Care Advocacy Network,OCAN is a diverse group of organizations that have come together to change how we perceive and approach obesity in the US. Obesity is a complex chronic disease.,"Washington, DC",https://pbs.twimg.com/profile_images/1899837093158821889/azfmvsTH_normal.jpg,False,False,2019-10-14 14:53:58+00:00,https://t.co/HtLDw5sqrp,952.0,241.0,2103.0,8.0
1943682457993200126,1573280302327373827,2025-07-11 14:43:04+00:00,"Ngl I’ve been binging so much bcz my grandmas trying to get me into modeling, and i need to lose at least half of what i am now . Which idefk bcz I don’t have scale til tmr 😒 . Besides All that bullshit. Idfk she’s literally trying to get me on ozempic . https://t.co/8Puy52D5SJ",en,,0,0,0,0,[],[],['https://x.com/Mut4lat3dmUs3/status/1943682457993200126/photo/1'],False,1943682457993200126,everyone,[],[],0.0,0.0,Ngl Ive been binging so much bcz my grandmas trying to get me into modeling and i need to lose at least half of what i am now . Which idefk bcz I dont have scale til tmr . Besides All that bullshit. Idfk shes literally trying to get me on ozempic .,5,False,False,False,False,False,False,False,False,False,False,Mut4lat3dmUs3,𝐴𝑏𝑏𝑖𝑒 ₍^. .^₎⟆ ᔆʰᵉᵈᵗʷᵗ,᧔࿔᧓ 𝑇ℎ𝑒 𝑊𝑜𝑟𝑙𝑑 𝐼𝑠 𝑆𝑜 𝑈𝑛𝑓𝑎𝑖𝑟 𝐼 𝐻𝑎𝑣𝑒 𝑇𝑜 𝐷𝑖𝑒,"Bulimic, BED . She/her",https://pbs.twimg.com/profile_images/1940898400691425280/MMH3byo7_normal.jpg,False,False,2022-09-23 11:57:23+00:00,,224.0,244.0,6240.0,4.0
1943666723271344242,1551960015862382593,2025-07-11 13:40:33+00:00,"Can really understand how Ozempic et al work by turning of your ""food thoughts"". I only get ""food thoughts"" when I'm not distracted. Like waiting for a van, with the snack machine whispering to me. 

Snacksssss. Crispsssss. Chocolotolate...",en,,0,0,0,0,[],[],[],False,1943666723271344242,everyone,"['Automotive, Aircraft & Boat Business']",[],0.0,0.0,Can really understand how Ozempic et al work by turning of your food thoughts. I only get food thoughts when Im not distracted. Like waiting for a van with the snack machine whispering to me. Snacksssss. Crispsssss. Chocolotolate.,6,True,False,False,False,False,False,False,False,False,False,4thWaveStevie,Steve Chambers,Workflow automation with app building and generative AI. Also a commercial driver in a bib.,"Leeds, UK",https://pbs.twimg.com/profile_images/1933824062783885312/fYGMipzn_normal.jpg,False,False,2022-07-26 15:58:03+00:00,https://t.co/M8rU5TBMrk,1544.0,1738.0,29914.0,8.0
1943642119513534583,18820955,2025-07-11 12:02:47+00:00,"Day 54 on the weight loss injection Mounjaro:  

Feeling hungry. Pretty sure that’s not meant to happen on this drug! Would up the dose to 5mg but it costs £30 extra and apparently the side effects can be worse.

Total loss: 9.2kg

Start weight: 84.8kg  

Today’s weight: 75.6kg https://t.co/0wMMVMSATz",en,,0,1,12,0,[],[],['https://x.com/ArianeSherine/status/1943642119513534583/photo/1'],False,1943642119513534583,everyone,[],[],1.0,13.0,Day 54 on the weight loss injection Mounjaro  Feeling hungry. Pretty sure thats not meant to happen on this drug! Would up the dose to 5mg but it costs £30 extra and apparently the side effects can be worse. Total loss  9.2kg Start weight  84.8kg Todays weight  75.6kg,7,True,False,False,False,False,False,False,False,False,False,ArianeSherine,Ariane Sherine,"Writer, journalist, author, photographer. Pop star as @arianexmusic. Debut solo electropop album BETTER out now on Bandcamp. Lucky girlfriend of @adamjuniper.","London, UK",https://pbs.twimg.com/profile_images/1865308041698070528/eQbqbXmH_normal.jpg,False,False,2009-01-10 00:03:37+00:00,https://t.co/c84Xo9IJT2,9849.0,2423.0,52165.0,372.0
1943637397813526553,702092653,2025-07-11 11:44:01+00:00,Day 2 on mounjaro feeling good just very tired. Not feeling particularly hungry and food noise is low. No other side effects at the moment. #weightlossjourney #weightlossinjection,en,,0,0,1,0,"['weightlossjourney', 'weightlossinjection']",[],[],False,1943637397813526553,everyone,[],[],0.0,1.0,Day 2 on mounjaro feeling good just very tired. Not feeling particularly hungry and food noise is low. No other side effects at the moment.,8,True,False,False,False,False,False,False,False,False,False,newt_kiters,Newt,"Not rich not famous but trying!
#teamginger","Liverpool, England",https://pbs.twimg.com/profile_images/1916530560811311104/Tc3C1UZj_normal.jpg,False,False,2012-07-18 01:06:19+00:00,,975.0,367.0,27647.0,2.0
1943633649842204912,2885363901,2025-07-11 11:29:07+00:00,GLP-1 and the rise of mood foods: A new appetite for functional indulgence https://t.co/g5ipcdFHnX,en,,0,0,0,0,[],[],['https://www.bakeryandsnacks.com/Article/2025/07/10/how-glp-1-drugs-are-reshaping-snacks-indulgence-and-mood-foods/'],False,1943633649842204912,everyone,[],[],0.0,0.0,GLP-1 and the rise of mood foods  A new appetite for functional indulgence,9,False,False,False,True,False,False,False,True,False,False,HyslopGill,Gill Hyslop,Editor at https://t.co/jAOuxqK4cY. Wordaholic and food fanatic. I really couldn't have a better job!,"Ayr, Scotland",https://pbs.twimg.com/profile_images/796032977486680070/7gBlfuw4_normal.jpg,False,False,2014-11-20 08:02:03+00:00,https://t.co/n3LTyI73Ht,191.0,194.0,3100.0,6.0
1943630213348290837,1706691658379558912,2025-07-11 11:15:28+00:00,The new snack wrap chicken taste like if a fat bitch took ozempic,en,,0,0,0,0,[],[],[],False,1943630213348290837,everyone,[],[],0.0,0.0,The new snack wrap chicken taste like if a fat bitch took ozempic,10,False,False,False,False,False,False,False,False,False,False,sexborger,Lgbtsexburger,I can feel pain in my dih 💔💔💔💔💔,Mars,https://pbs.twimg.com/profile_images/1935184239961464832/UKTJvqId_normal.jpg,False,False,2023-09-26 15:26:39+00:00,https://t.co/SKeD9CzLzu,215.0,655.0,7952.0,1.0
1943527765673718216,1682571557313343488,2025-07-11 04:28:22+00:00,Necesito un strawberry matcha lemonade labubu 24k ai gold ozempic stanley lululemon dubai chocolate benson boone crumbl starbucks,en,,0,1,1,0,[],[],[],False,1943527765673718216,everyone,"['Benson Boone', 'Dining', 'QSR - Dining', 'Sports/Outdoor - Fashion', 'Food & Beverage Business', 'Textile, Apparel & Luxury Good Business', 'Starbucks', 'Lululemon', 'Benson Boone', 'Food', 'Fashion Brand', 'Starbucks', 'Tea', 'Matcha', 'Coffee', 'Sports/Outdoor - Fashion', 'Lululemon', 'Lululemon', 'Athletic apparel']",[],1.0,2.0,Necesito un strawberry matcha lemonade labubu 24k ai gold ozempic stanley lululemon dubai chocolate benson boone crumbl starbucks,11,False,False,False,False,False,False,False,False,False,False,remmomazos,r,,,https://pbs.twimg.com/profile_images/1943523300451229696/5hnHbAGR_normal.jpg,False,False,2023-07-22 02:01:41+00:00,,10.0,16.0,1187.0,0.0
1943447472522826078,1835849240612134912,2025-07-10 23:09:19+00:00,Hunger strikes still count on ozempic.,en,,0,0,0,0,[],[],[],False,1943447472522826078,everyone,[],[],0.0,0.0,Hunger strikes still count on ozempic.,12,False,False,False,False,False,False,False,False,False,False,BudgetCaliphate,Jihad on a Shoestring 🇵🇸,"💰 Low-budget terror, high-effort struggle. Crowdfunding the caliphate one donation at a time. DM for discount RPGs. #FinancialJihad #GoFundTheCause",,https://pbs.twimg.com/profile_images/1904212725414428672/zTpFQt0x_normal.jpg,False,False,2024-09-17 01:12:43+00:00,,156.0,130.0,6360.0,4.0
1943439284998148429,1940516998284562435,2025-07-10 22:36:47+00:00,GLP 1 no hungry pain Day 1 https://t.co/CAn0dNrOFO via @YouTube,en,,0,0,0,0,[],['YouTube'],['https://youtu.be/EjLxq5P6vEQ?si=QA664iFp9fq_LPYj'],False,1943439284998148429,everyone,[],[],0.0,0.0,GLP 1 no hungry pain Day 1 via @YouTube,13,True,False,False,False,False,False,False,False,False,False,Brandbox_ATL,BrandboxATL,"Sharing my real Zepbound journey. Weight loss, tips & honest results. Partnered with BrandBox ATL — where vision meets strategy.",Atlanta GA,https://pbs.twimg.com/profile_images/1944458233818554369/hfH-86Wd_normal.jpg,False,False,2025-07-02 22:08:18+00:00,,3.0,16.0,17.0,0.0
1943436605349364027,2945888140,2025-07-10 22:26:08+00:00,"In a paper released in Addiction, scientists reported that people with a history of alcohol use disorder who were prescribed these medications were 50% less likely to binge drink. The results were similarly striking for those struggling with opioids. https://t.co/nfqnlwFOvB",en,,0,0,0,0,[],[],['https://go.upcontent.com/34ff7b3e-7cdc-45ec-8d55-18c3ec8e37e0'],False,1943436605349364027,everyone,[],[],0.0,0.0,In a paper released in Addiction scientists reported that people with a history of alcohol use disorder who were prescribed these medications were 50% less likely to binge drink. The results were similarly striking for those struggling with opioids.,14,False,False,False,False,False,False,False,False,True,False,maryannlubeskie,Mary Ann Lubeskie,"Bold, passionate, results driven leader in managed care and claims",Hartford CT,https://pbs.twimg.com/profile_images/549207804771192832/bRZk1uSW_normal.jpeg,False,False,2014-12-28 14:15:48+00:00,http://t.co/KErk3r4ZQE,399.0,268.0,3624.0,9.0
1943426682586558686,1788135583010967552,2025-07-10 21:46:42+00:00,"The featured offer of today's show is the MindBody GLP-1 System by Life Vantage.

Support stable blood sugar, reduce carb cravings, and regain control over hunger—a revolutionary, drug-free approach.
https://t.co/4sO7mj3RWa https://t.co/0g6LUs7FTj",en,,0,0,1,1,[],[],"['https://callinghealers.lifevantage.com/us-en/shop/mindbody-glp-1-system', 'https://x.com/TheSpeakerSalon/status/1943426682586558686/photo/1']",False,1943426682586558686,everyone,[],[],1.0,2.0,The featured offer of todays show is the MindBody GLP-1 System by Life Vantage. Support stable blood sugar reduce carb cravings and regain control over hunger—a revolutionary drug-free approach.,15,False,False,False,False,False,False,False,False,False,False,TheSpeakerSalon,Speaker Salon,#SpacesHost Every Other Thursday 🎙️Covering Human Ecology & Life-Giving Forces 🛟 Hosted by @AlanaNewmanCA 👩‍💻,"California, USA",https://pbs.twimg.com/profile_images/1794484910193020929/Va79wf5p_normal.jpg,False,False,2024-05-08 09:15:38+00:00,https://t.co/KWpDeU9EsL,507.0,196.0,542.0,2.0
1943419876993044827,1666465827804139521,2025-07-10 21:19:40+00:00,"Old me: Struggling with cravings, slow progress, and frustration.

New me: In control, energized, and finally seeing real results with GLP-1 support!

Ready to upgrade your journey? Discover the difference at https://t.co/JdtYe95eti

#NewYou  #BeforeAndAfter #RealResults https://t.co/psZM81tVmd",en,,0,0,0,0,"['NewYou', 'BeforeAndAfter', 'RealResults']",[],"['http://medicaweightloss.com', 'https://x.com/JosephC03951327/status/1943419876993044827/photo/1']",False,1943419876993044827,everyone,[],[],0.0,0.0,Old me  Struggling with cravings slow progress and frustration. New me  In control energized and finally seeing real results with GLP-1 support! Ready to upgrade your journey? Discover the difference at,16,False,False,False,False,False,True,False,True,False,False,JosephC03951327,Joseph C,,,https://pbs.twimg.com/profile_images/1714741154594377728/H2tr4OEH_normal.jpg,False,False,2023-06-07 15:23:44+00:00,,1.0,66.0,35.0,0.0
1943419671828439419,1192456923653783552,2025-07-10 21:18:51+00:00,"Old me: Struggling with cravings, slow progress, and frustration.

New me: In control, energized, and finally seeing real results with GLP-1 support!

Ready to upgrade your journey? Discover the difference at https://t.co/y81Zccsn0M

#NewYou #GLP1 #Transformation #WeightLoss https://t.co/g1D6JCvPaq",en,,0,0,1,0,"['NewYou', 'GLP1', 'Transformation', 'WeightLoss']",[],"['http://medicaweightloss.com', 'https://x.com/onemedicalwl/status/1943419671828439419/photo/1']",False,1943419671828439419,everyone,"['Sports & Fitness Business', 'Fitness']",[],0.0,1.0,Old me  Struggling with cravings slow progress and frustration. New me  In control energized and finally seeing real results with GLP-1 support! Ready to upgrade your journey? Discover the difference at,17,False,False,False,False,False,True,False,True,False,False,onemedicalwl,Medica Weight Loss,"Your weight loss journey, simplified. Personalized plans, GLP-1 options, and expert support to help you feel your best. Let’s do this together!",United States,https://pbs.twimg.com/profile_images/1897381070514847744/EmBGEr76_normal.jpg,False,False,2019-11-07 15:01:21+00:00,https://t.co/zVa3nCL4IH,12.0,36.0,113.0,0.0
1943378477203284306,1649073165602045954,2025-07-10 18:35:09+00:00,"A gut microbe may be the natural key to regulating blood sugar and curbing sugar cravings—and could work just like Ozempic. Discover the new research. #GutHealth #OzempicAlternative #BloodSugar

https://t.co/k4nQs89CZ4",en,,0,0,0,0,"['GutHealth', 'OzempicAlternative', 'BloodSugar']",[],['https://hsionline.com/2025/05/15/this-gut-microbe-could-be-natures-ozempic/'],False,1943378477203284306,everyone,[],[],0.0,0.0,A gut microbe may be the natural key to regulating blood sugar and curbing sugar cravings—and could work just like Ozempic. Discover the new research.,18,False,False,False,False,False,False,False,False,False,False,HSI_news,Health Science Institute,,,https://pbs.twimg.com/profile_images/1649073333386838018/Cw9glXjR_normal.jpg,False,False,2023-04-20 15:31:03+00:00,,5.0,20.0,543.0,0.0
1943363562430456287,1454110588255145989,2025-07-10 17:35:53+00:00,Oomfie On ozempic but eating a 1000 cal ice cream 🤪,en,,0,2,7,0,[],[],[],False,1943363562430456287,everyone,"['Food & Beverage Business', 'Food', 'Food experience']",[],2.0,9.0,Oomfie On ozempic but eating a 1000 cal ice cream,19,False,False,False,False,False,False,False,False,False,False,hardcandypatrik,patrick 🍭 🍬 #HARDCANDY,🔞. Madonna • Gaga • Lana • Bey • CRJ • Sufjan • Lorde • XCX • Katy • Bowie • Ariana Grande . not lgbt,"Los Angeles, CA ",https://pbs.twimg.com/profile_images/1919543609537466368/Ptqh8axk_normal.jpg,False,False,2021-10-29 15:39:21+00:00,,661.0,734.0,28938.0,1.0
1943352542118699047,410535062,2025-07-10 16:52:06+00:00,Who's going to be the first to release a chocolate bar with ozempic built in and market it as basically celery?,en,,0,0,0,0,[],[],[],False,1943352542118699047,everyone,[],[],0.0,0.0,Whos going to be the first to release a chocolate bar with ozempic built in and market it as basically celery?,20,False,False,False,False,False,False,False,False,False,False,StefanBuilds,Stefan 🚀,"Building @vibecombinator 🚀

https://t.co/YFzcuSJ0n5: landing page roasts 🔥
https://t.co/HEqdiF8MKz: free work spots 🛋 
https://t.co/x1J8ZHPK83: break timer 🌱
https://t.co/dgoyHQXxOL 🍁",,https://pbs.twimg.com/profile_images/1911223742220365824/F_Bve8EY_normal.jpg,False,False,2011-11-12 06:56:06+00:00,https://t.co/plbaCdQkaq,919.0,500.0,8403.0,24.0
1943339332439355560,1754988501697789952,2025-07-10 15:59:37+00:00,guys if you binge too much and get type 2 diabetes you’ll have to go on ozempic so technically you can lose weight by binging at some point #brain,en,,0,0,2,0,['brain'],[],[],False,1943339332439355560,everyone,[],[],0.0,2.0,guys if you binge too much and get type 2 diabetes youll have to go on ozempic so technically you can lose weight by binging at some point,21,False,False,False,True,False,False,False,False,False,False,moedoll_,‏۟,𓊆ྀི non ⠀ sharing ⠀ #魈⠀ yume 𓊇ྀི ⠀ ⠀ ⠀ ⠀ ꒰ྀི shedtwt ꒱ྀི 🐰 𝗸𝗶𝗻 𝗳𝘂𝗿𝗶𝗻𝗮 𝗻𝗱 𝘀𝗰𝗮𝗿𝗮 | 16 | DM OK .ᐟ,   ྐ❤︎ ིྀ  𓏵  tw  vent ,https://pbs.twimg.com/profile_images/1937632071456796672/wmd7m-aJ_normal.jpg,False,False,2024-02-06 22:01:30+00:00,,666.0,765.0,3599.0,6.0
1943338510150205525,1724924135393107968,2025-07-10 15:56:20+00:00,"“She lost with ozempic, that’s cheating.”
Y’all know it just reduces your appetite right?? They get less cravings that’s it. It doesn’t make your metabolism go crazy and make you lose weight magically. They still have to do a cal deficit and workout to lose the weight.",en,,1,6,155,1,[],[],[],False,1943338510150205525,everyone,['Exercises'],[],7.0,163.0,She lost with ozempic thats cheating. Yall know it just reduces your appetite right?? They get less cravings thats it. It doesnt make your metabolism go crazy and make you lose weight magically. They still have to do a cal deficit and workout to lose the weight.,22,True,False,False,False,False,False,False,False,False,False,yvesskin,yves,what a shame she is fcked in the head,,https://pbs.twimg.com/profile_images/1940650332100460547/RY-JqlkY_normal.jpg,False,False,2023-11-15 22:55:42+00:00,,4483.0,385.0,7565.0,17.0
1943317969158680653,845716710,2025-07-10 14:34:43+00:00,Golden Mounjaro dose that shifts most weight &amp; why it's OK to be hungry on jabs https://t.co/HYMqdv7SpQ,en,,0,0,0,0,[],[],['https://www.thesun.co.uk/health/35782030/golden-dose-mounjaro-lose-most-weight-hungry-fat-jab/?utm_term=Autofeed&utm_medium=Social&utm_source=Twitter#Echobox=1752150228'],False,1943317969158680653,everyone,[],[],0.0,0.0,Golden Mounjaro dose that shifts most weight & why its OK to be hungry on jabs,23,False,False,False,False,False,False,False,False,False,False,TheSunHealth,SunHealth,"Everything you need to know about your health, wellbeing and fitness from @TheSun.",,https://pbs.twimg.com/profile_images/798532221242142720/RiRQu7aS_normal.jpg,False,False,2012-09-25 15:26:19+00:00,https://t.co/HvCGy2R2u2,758.0,142.0,22533.0,20.0
1943287596794171494,1917156721245515777,2025-07-10 12:34:02+00:00,"Hi, 
Been trying to eat better without going crazy over cravings — this SheMed blog was honestly helpful.
https://t.co/9WpnwF0nfI

#SmallStepsBigChange #CravingHelp #SheMed @BudgetDiet",en,,0,0,0,0,"['SmallStepsBigChange', 'CravingHelp', 'SheMed']",['BudgetDiet'],['https://www.shemed.co.uk/blog/mounjaro-outperforms-wegovy-in-major-weight-loss-drug-trial'],False,1943287596794171494,everyone,[],[],0.0,0.0,Hi Been trying to eat better without going crazy over cravings — this SheMed blog was honestly helpful. @BudgetDiet,24,False,False,False,False,False,False,False,False,False,False,HarryWard19949,Harry Ward,,,https://pbs.twimg.com/profile_images/1917157606604562432/LjeAO_7D_normal.jpg,False,False,2025-04-29 09:59:42+00:00,,3.0,533.0,546.0,0.0
1943256570370101469,18820955,2025-07-10 10:30:44+00:00,"Day 53 on the weight loss injection Mounjaro:  

Finally stopped celebrating my birthday and snacking on the ice cream in the freezer.

Also: have stopped the photos taken in bed. Hope you’re happy, prudes!

Total loss: 9.05kg

Start weight: 84.8kg  

Today’s weight: 75.75kg https://t.co/gybX0a0nIS",en,,0,1,11,0,[],[],['https://x.com/ArianeSherine/status/1943256570370101469/photo/1'],False,1943256570370101469,everyone,[],[],1.0,12.0,Day 53 on the weight loss injection Mounjaro  Finally stopped celebrating my birthday and snacking on the ice cream in the freezer. Also  have stopped the photos taken in bed. Hope youre happy prudes! Total loss  9.05kg Start weight  84.8kg Todays weight  75.75kg,25,True,False,False,False,False,False,False,False,False,False,ArianeSherine,Ariane Sherine,"Writer, journalist, author, photographer. Pop star as @arianexmusic. Debut solo electropop album BETTER out now on Bandcamp. Lucky girlfriend of @adamjuniper.","London, UK",https://pbs.twimg.com/profile_images/1865308041698070528/eQbqbXmH_normal.jpg,False,False,2009-01-10 00:03:37+00:00,https://t.co/c84Xo9IJT2,9849.0,2423.0,52165.0,372.0
1943221810025152614,1859685190571876352,2025-07-10 08:12:37+00:00,"STDEI® GLP-1 Oral Solution burns fat, curbs hunger, balances sugar, and boosts energy—natural, safe, and effective in just 7 days
https://t.co/14YxiNTXu6 https://t.co/JOLAtViMbI",en,,0,0,0,0,[],[],"['https://lovilds.sale/stdei-glp-1-weight-loss-oral-solution/', 'https://x.com/megamalloo/status/1943221810025152614/photo/1']",False,1943221810025152614,everyone,['Food & Beverage Business'],[],0.0,0.0,STDEI GLP-1 Oral Solution burns fat curbs hunger balances sugar and boosts energy—natural safe and effective in just 7 days,26,False,False,False,False,False,False,False,True,False,False,megamalloo,Online Shopping,"Your go-to destination for trending fashion, smart gadgets, beauty must-haves, and home essentials. Fast delivery and trusted service worldwide.",London,https://pbs.twimg.com/profile_images/1926969439859216385/Ht2PMDOX_normal.jpg,False,False,2024-11-21 19:48:10+00:00,https://t.co/8im3Ynhtss,1.0,1.0,5844.0,0.0
1943191400616456432,1890373280034676736,2025-07-10 06:11:47+00:00,"STDEI® GLP-1 Oral Solution reduces cravings, burns fat, balances sugar, boosts energy and immunity — science-backed, MHRA approved, safe results in 7 days.

https://t.co/HPSKu0vcbv https://t.co/7GGxaDtCJG",en,,0,0,0,0,[],[],"['https://gooshopo.com/glp-1-weight-loss-oral-solution/', 'https://x.com/GooShopo/status/1943191400616456432/photo/1']",False,1943191400616456432,everyone,[],[],0.0,0.0,STDEI GLP-1 Oral Solution reduces cravings burns fat balances sugar boosts energy and immunity — science-backed MHRA approved safe results in 7 days.,27,False,False,False,False,False,False,False,True,False,False,GooShopo,Online Store,Exploring trends and sharing the best deals worldwide.,London,https://pbs.twimg.com/profile_images/1927022598342230016/H-AFmkn5_normal.jpg,False,False,2025-02-14 12:11:39+00:00,https://t.co/IXibbxCtGf,10.0,0.0,6058.0,0.0
