id,author_id,created_at,text,lang,source,retweet_count,reply_count,like_count,quote_count,hashtags,mentions,urls,possibly_sensitive,conversation_id,reply_settings,context_entities,referenced_tweets,total_reply,total_engage,text_clean,tmpid,Effectiveness_of_GLP1_Agonists,Personal_Experiences_and_Side_Effects,Perceptions_of_Weight_Loss,Food_Industry_Perceptions,Addiction_and_Cravings,Weight_Loss_Journey,Marketing_and_Product_Ideas,Mood_and_Energy,Scientific_Information,Societal_Issues,author_username,author_name,author_description,author_location,author_profile_image,author_protected,author_verified,author_created_at,author_url,author_followers_count,author_following_count,author_tweet_count,author_listed_count
1942630730162659631,2513880943,2025-07-08 17:03:53+00:00,"@adamdotdev Imagine having the capacity for half of this... I'll settle for avoiding junk, super-processed and big-ag-foods when possible, and aimlessly walking the dog. By the way, a healthy dog will not let you rest without having gotten proper exercise. They don't care about your sciatica",en,,0,0,0,0,[],['adamdotdev'],[],False,1941973120455262574,everyone,[],[<ReferencedTweet id=1941973120455262574 type=replied_to>],,,@adamdotdev Imagine having the capacity for half of this. Ill settle for avoiding junk super-processed and big-ag-foods when possible and aimlessly walking the dog. By the way a healthy dog will not let you rest without having gotten proper exercise. They dont care about your sciatica,233,,,,,,,,,,,,,,,,,,,,,,,
1942629187765833768,17308319,2025-07-08 16:57:45+00:00,"@STOPED2018 @adamdotdev The MOMENT I hit a weight problem was immediately after that, when my metabolism became more normal and I went from 52kg to 81kg all at once, WHILE I was cutting back to only 2-3 meals a day.

It was absurd. I have been up &amp; down for 40 years since, but I'm ""normal"" now.",en,,0,0,0,0,[],"['STOPED2018', 'adamdotdev']",[],False,1941973120455262574,everyone,"['Food & Beverage Business', 'Food', 'Meals', 'Food experience']",[<ReferencedTweet id=1942628791081468135 type=replied_to>],,,@STOPED2018 @adamdotdev The MOMENT I hit a weight problem was immediately after that when my metabolism became more normal and I went from 52kg to 81kg all at once WHILE I was cutting back to only 2-3 meals a day. It was absurd. I have been up & down for 40 years since but Im normal now.,234,,,,,,,,,,,,,,,,,,,,,,,
1942628791081468135,17308319,2025-07-08 16:56:10+00:00,"@STOPED2018 @adamdotdev Perhaps funny story: I had the opposite problem. i had a very dysfunctional metabolism as a lad, eating 5 full meals a day and still looking emaciated. I didn't hit puberty until I was 15, and came out of high school at 5'11"" and 115lbs (almost 2 meters tall, 52 kg).",en,,0,2,0,0,[],"['STOPED2018', 'adamdotdev']",[],False,1941973120455262574,everyone,"['Food & Beverage Business', 'Food', 'Meals', 'Food experience']",[<ReferencedTweet id=1942628233725284499 type=replied_to>],,,@STOPED2018 @adamdotdev Perhaps funny story  I had the opposite problem. i had a very dysfunctional metabolism as a lad eating 5 full meals a day and still looking emaciated. I didnt hit puberty until I was 15 and came out of high school at 511 and 115lbs (almost 2 meters tall 52 kg).,235,,,,,,,,,,,,,,,,,,,,,,,
1942628443977310367,284740244,2025-07-08 16:54:47+00:00,"@adamdotdev I guess I'm the weird one, this is basically my life (with the exception of not eating after 2 pm). Why I'm 45 with a six pack",en,,0,0,0,0,[],['adamdotdev'],[],False,1941973120455262574,everyone,[],[<ReferencedTweet id=1941973120455262574 type=replied_to>],,,@adamdotdev I guess Im the weird one this is basically my life (with the exception of not eating after 2 pm). Why Im 45 with a six pack,236,,,,,,,,,,,,,,,,,,,,,,,
1942628233725284499,17308319,2025-07-08 16:53:57+00:00,"@STOPED2018 @adamdotdev My own weight is different. Unlike the person I was talking about, I CAN move more &amp; eat less. I'm even working on that.",en,,0,1,0,0,[],"['STOPED2018', 'adamdotdev']",[],False,1941973120455262574,everyone,[],[<ReferencedTweet id=1942626833469694373 type=replied_to>],,,@STOPED2018 @adamdotdev My own weight is different. Unlike the person I was talking about I CAN move more & eat less. Im even working on that.,237,,,,,,,,,,,,,,,,,,,,,,,
1942627608874697038,1230194775493619712,2025-07-08 16:51:28+00:00,@davepl1968 @adamdotdev Oh hey daves garage,en,,0,0,0,0,[],"['davepl1968', 'adamdotdev']",[],False,1941973120455262574,everyone,[],[<ReferencedTweet id=1942358786712457313 type=replied_to>],,,@davepl1968 @adamdotdev Oh hey daves garage,238,,,,,,,,,,,,,,,,,,,,,,,
1942626991015874729,1017972651862708227,2025-07-08 16:49:01+00:00,"@adamdotdev That's a whole lot of text. Happy for you, or sorry that happened",en,,0,0,0,0,[],['adamdotdev'],[],False,1941973120455262574,everyone,[],[<ReferencedTweet id=1941973120455262574 type=replied_to>],,,@adamdotdev Thats a whole lot of text. Happy for you or sorry that happened,239,,,,,,,,,,,,,,,,,,,,,,,
1942626989464248574,65498076,2025-07-08 16:49:01+00:00,"@tottinge @adamdotdev Know a person who fasted for more than a month. And another fasted a week without water. So yeah, people are mostly ignorant of what they can or are simply weak.  (Me including) I do not propagate anything. I am comparing facts.",en,,0,0,0,0,[],"['tottinge', 'adamdotdev']",[],False,1941973120455262574,everyone,"['Food & Beverage Business', 'Food', 'Drinks', 'Generic Drinks', 'Water', 'Drinks', 'Water']",[<ReferencedTweet id=1942164397004128271 type=replied_to>],,,@tottinge @adamdotdev Know a person who fasted for more than a month. And another fasted a week without water. So yeah people are mostly ignorant of what they can or are simply weak. (Me including) I do not propagate anything. I am comparing facts.,240,,,,,,,,,,,,,,,,,,,,,,,
1942626833469694373,17308319,2025-07-08 16:48:24+00:00,"@STOPED2018 @adamdotdev I don't mean ""eat to sickness"" but ""eat to fullness"" rather than ""eat to calorie limitation"".  That means sometimes having a bit of ice cream for dessert, or maybe a comfort food rather than a salad when one is having a high pain day.",en,,0,2,0,0,[],"['STOPED2018', 'adamdotdev']",[],False,1941973120455262574,everyone,"['Food & Beverage Business', 'Food', 'Food experience', 'Food', 'Comfort Food', 'Food', 'Comfort Food', 'Cooking', 'Desserts and baked goods']",[<ReferencedTweet id=1942223369132241120 type=replied_to>],,,@STOPED2018 @adamdotdev I dont mean eat to sickness but eat to fullness rather than eat to calorie limitation. That means sometimes having a bit of ice cream for dessert or maybe a comfort food rather than a salad when one is having a high pain day.,241,,,,,,,,,,,,,,,,,,,,,,,
1942621491205456158,1694704395475443712,2025-07-08 16:27:10+00:00,"@adamdotdev Too easy. Just do all the above, plus change to smaller plates, portion sizes, and use blinders most of the day. no idea why people are so lazy. 

also, stay fat so i can feel good about myself",en,,0,0,0,0,[],['adamdotdev'],[],False,1941973120455262574,everyone,[],[<ReferencedTweet id=1941973120455262574 type=replied_to>],,,@adamdotdev Too easy. Just do all the above plus change to smaller plates portion sizes and use blinders most of the day. no idea why people are so lazy. also stay fat so i can feel good about myself,242,,,,,,,,,,,,,,,,,,,,,,,
1942614671212597444,1256326838353264640,2025-07-08 16:00:04+00:00,@adamdotdev i wake up at like 11 am wdym done eating at 2 pm,en,,0,0,0,0,[],['adamdotdev'],[],False,1941973120455262574,everyone,[],[<ReferencedTweet id=1941973120455262574 type=replied_to>],,,@adamdotdev i wake up at like 11 am wdym done eating at 2 pm,243,,,,,,,,,,,,,,,,,,,,,,,
1942604669294973384,1568177081405640705,2025-07-08 15:20:19+00:00,"@adamdotdev - sleep 7hrs+
- do any kind of exercise 3-4x a week
- eat more protein, and fewer calories overall

it's that simple. don't need to go full longevity bro",en,,0,0,2,0,[],['adamdotdev'],[],False,1941973120455262574,everyone,[],[<ReferencedTweet id=1941973120455262574 type=replied_to>],,,@adamdotdev - sleep 7hrs+ - do any kind of exercise 3-4x a week - eat more protein and fewer calories overall its that simple. dont need to go full longevity bro,244,,,,,,,,,,,,,,,,,,,,,,,
1942601844779540630,29547911,2025-07-08 15:09:06+00:00,@adamdotdev sounds sad,en,,0,0,0,0,[],['adamdotdev'],[],False,1941973120455262574,everyone,[],[<ReferencedTweet id=1941973120455262574 type=replied_to>],,,@adamdotdev sounds sad,245,,,,,,,,,,,,,,,,,,,,,,,
1942600465553994046,1817874293864517632,2025-07-08 15:03:37+00:00,"@adamdotdev I think these new drugs will be a lot like how people view internet privacy. It’s nice to have a stance, but you look like a real weirdo when your tinder date asks for your instagram which you don’t have cause of “privacy” 

don’t be fat",en,,0,0,1,0,[],['adamdotdev'],[],False,1941973120455262574,everyone,"['Tinder', 'Tinder', 'Dating Apps']",[<ReferencedTweet id=1941973120455262574 type=replied_to>],,,@adamdotdev I think these new drugs will be a lot like how people view internet privacy. Its nice to have a stance but you look like a real weirdo when your tinder date asks for your instagram which you dont have cause of privacy dont be fat,246,,,,,,,,,,,,,,,,,,,,,,,
1942597416609554804,1164662691488829447,2025-07-08 14:51:30+00:00,@adamdotdev No one needs diet or nutrition advice from a random betting bro.,en,,0,0,0,0,[],['adamdotdev'],[],False,1941973120455262574,everyone,"['Food & Beverage Business', 'Food', 'Dieting']",[<ReferencedTweet id=1941973120455262574 type=replied_to>],,,@adamdotdev No one needs diet or nutrition advice from a random betting bro.,247,,,,,,,,,,,,,,,,,,,,,,,
1942593459837128807,1157965549,2025-07-08 14:35:47+00:00,"@adamdotdev the funny thing is that if you actually meticulously implement ALL of this list, you'll likely become unwell in a different way :) orthorexia etc.",en,,0,0,0,0,[],['adamdotdev'],[],False,1941973120455262574,everyone,[],[<ReferencedTweet id=1941973120455262574 type=replied_to>],,,@adamdotdev the funny thing is that if you actually meticulously implement ALL of this list youll likely become unwell in a different way  ) orthorexia etc.,248,,,,,,,,,,,,,,,,,,,,,,,
1942592238095135016,1309409339824840704,2025-07-08 14:30:55+00:00,"@adamdotdev I kinda smell cope.

3-4 items on that list will do.

Plenty of people are thin, healthy and objectively fit. 

They don't do half of that, just watch what they eat, hit the gym 3 times per week and get 7 hours of sleep...

Maybe if we wouldn't scare turbonormies with those big",en,,0,0,1,0,[],['adamdotdev'],[],False,1941973120455262574,everyone,['Exercises'],[<ReferencedTweet id=1941973120455262574 type=replied_to>],,,@adamdotdev I kinda smell cope. 3-4 items on that list will do. Plenty of people are thin healthy and objectively fit. They dont do half of that just watch what they eat hit the gym 3 times per week and get 7 hours of sleep. Maybe if we wouldnt scare turbonormies with those big,249,,,,,,,,,,,,,,,,,,,,,,,
1942592087343653240,1454456755925266435,2025-07-08 14:30:19+00:00,"@adamdotdev A big part of society is toxic, not just the food",en,,0,0,0,0,[],['adamdotdev'],[],False,1941973120455262574,everyone,[],[<ReferencedTweet id=1941989807900512677 type=replied_to>],,,@adamdotdev A big part of society is toxic not just the food,250,,,,,,,,,,,,,,,,,,,,,,,
1942591363826249903,1877935071396864001,2025-07-08 14:27:27+00:00,"@uberiots @jmattprice @adamdotdev Bro that's RDA, rdas don't account for daily activity and everything else, I've been taking 800-1000 per day for years, biglscyinate, the trick is to spread out the dose 3 times a day, you can't get full saturation at 400 a day especially as a male, that just keeps the lights on",en,,0,0,0,0,[],"['uberiots', 'jmattprice', 'adamdotdev']",[],False,1941973120455262574,everyone,[],[<ReferencedTweet id=1942576671938470331 type=replied_to>],,,@uberiots @jmattprice @adamdotdev Bro thats RDA rdas dont account for daily activity and everything else Ive been taking 800-1000 per day for years biglscyinate the trick is to spread out the dose 3 times a day you cant get full saturation at 400 a day especially as a male that just keeps the lights on,251,False,False,False,False,False,False,False,False,False,False,,,,,,,,,,,,,
1942585624575594503,2246453394,2025-07-08 14:04:39+00:00,"@adamdotdev @jmattprice Yes, of course, but it’s also important to read about time management. This can help you find efficient strategies like fitting your daily meditation into your red light therapy session.",en,,0,0,0,0,[],"['adamdotdev', 'jmattprice']",[],False,1941973120455262574,everyone,"['Wellness and health', 'Meditation', 'Counseling and psychotherapy']",[<ReferencedTweet id=1941989220395979238 type=replied_to>],,,@adamdotdev @jmattprice Yes of course but its also important to read about time management. This can help you find efficient strategies like fitting your daily meditation into your red light therapy session.,252,False,False,False,False,False,False,False,False,False,False,,,,,,,,,,,,,
1942583831929696725,563995396,2025-07-08 13:57:31+00:00,"@adamdotdev Because we want to stay lazy, never change habits, binge watch, binge eat, binge life...",en,,0,0,0,0,[],['adamdotdev'],[],False,1941973120455262574,everyone,[],[<ReferencedTweet id=1941973120455262574 type=replied_to>],,,@adamdotdev Because we want to stay lazy never change habits binge watch binge eat binge life.,253,False,False,False,False,False,False,False,False,False,False,,,,,,,,,,,,,
1942582968813498524,18842214,2025-07-08 13:54:05+00:00,@dick_mojo @adamdotdev And they were,en,,0,0,0,0,[],"['dick_mojo', 'adamdotdev']",[],False,1941973120455262574,everyone,[],[<ReferencedTweet id=1942532231626645915 type=replied_to>],,,@dick_mojo @adamdotdev And they were,254,False,False,False,False,False,False,False,False,False,False,,,,,,,,,,,,,
1942581291657900501,983805788,2025-07-08 13:47:26+00:00,@adamdotdev @jmattprice I think he was mocking you.,en,,0,0,0,0,[],"['adamdotdev', 'jmattprice']",[],False,1941973120455262574,everyone,[],[<ReferencedTweet id=1941989220395979238 type=replied_to>],,,@adamdotdev @jmattprice I think he was mocking you.,255,False,False,False,False,False,False,False,False,False,False,,,,,,,,,,,,,
1942580961461326254,983805788,2025-07-08 13:46:07+00:00,@adamdotdev How much of your day would you end up devoting to getting those 10K steps? Half that number would take a big  chunk out of my day. I doubt you actually do that yourself.,en,,0,0,0,0,[],['adamdotdev'],[],False,1941973120455262574,everyone,[],[<ReferencedTweet id=1941973120455262574 type=replied_to>],,,@adamdotdev How much of your day would you end up devoting to getting those 10K steps? Half that number would take a big chunk out of my day. I doubt you actually do that yourself.,256,False,False,False,False,False,False,False,False,False,False,,,,,,,,,,,,,
1942579923568451892,1640349305516048386,2025-07-08 13:41:59+00:00,@adamdotdev So much food and things we enjoy that we get fat is a better problem to have than the opposite,en,,0,0,0,0,[],['adamdotdev'],[],False,1941973120455262574,everyone,[],[<ReferencedTweet id=1941989807900512677 type=replied_to>],,,@adamdotdev So much food and things we enjoy that we get fat is a better problem to have than the opposite,257,False,False,False,False,False,False,False,False,False,False,,,,,,,,,,,,,
1942578611011326077,1712501862845558784,2025-07-08 13:36:46+00:00,"@adamdotdev I am doing many things on this list, am very healthy, and I'd wager u don't need to do all of it. 

Avoiding processed foods is probably good enough overall. No stress, sleep don't require effort.

No need to go to the gym unless you want muscle mass.",en,,0,0,0,0,[],['adamdotdev'],[],False,1941973120455262574,everyone,['Exercises'],[<ReferencedTweet id=1941973120455262574 type=replied_to>],,,@adamdotdev I am doing many things on this list am very healthy and Id wager u dont need to do all of it. Avoiding processed foods is probably good enough overall. No stress sleep dont require effort. No need to go to the gym unless you want muscle mass.,258,False,False,False,False,False,False,False,False,False,False,,,,,,,,,,,,,
1942576912045338906,14844066,2025-07-08 13:30:01+00:00,"@adamdotdev If you want a serious discussion to increase your understanding you’re more than welcome to DM.

The advice is correct but naive because it’s sometimes not attainable because of circumstances &amp; genetics.

I’ve never taken any GLP drugs and I’ve used to have this healthy",en,,0,0,1,0,[],['adamdotdev'],[],False,1941973120455262574,everyone,[],[<ReferencedTweet id=1941973120455262574 type=replied_to>],,,@adamdotdev If you want a serious discussion to increase your understanding youre more than welcome to DM. The advice is correct but naive because its sometimes not attainable because of circumstances & genetics. Ive never taken any GLP drugs and Ive used to have this healthy,259,False,False,False,False,False,False,False,False,False,False,,,,,,,,,,,,,
1942576671938470331,1094870840997363712,2025-07-08 13:29:04+00:00,@TheFinalLarp @jmattprice @adamdotdev Thought 400 mg daily was the upper limit.,en,,0,1,0,0,[],"['TheFinalLarp', 'jmattprice', 'adamdotdev']",[],False,1941973120455262574,everyone,[],[<ReferencedTweet id=1942304208226771314 type=replied_to>],,,@TheFinalLarp @jmattprice @adamdotdev Thought 400 mg daily was the upper limit.,260,False,False,False,False,False,False,False,False,False,False,,,,,,,,,,,,,
1942576085708988501,14510165,2025-07-08 13:26:44+00:00,@adamdotdev Don’t forget staring at the sun for 30 minutes.,en,,0,0,0,0,[],['adamdotdev'],[],False,1941973120455262574,everyone,[],[<ReferencedTweet id=1941973120455262574 type=replied_to>],,,@adamdotdev Dont forget staring at the sun for 30 minutes.,261,False,False,False,False,False,False,False,False,False,False,,,,,,,,,,,,,
1942573827432820919,116508995,2025-07-08 13:17:46+00:00,"@adamdotdev Yes, environmental toxicity. Eat and move like our ancestors did. It’s fun, and more enjoyable",en,,0,0,0,0,[],['adamdotdev'],[],False,1941973120455262574,everyone,[],[<ReferencedTweet id=1941973120455262574 type=replied_to>],,,@adamdotdev Yes environmental toxicity. Eat and move like our ancestors did. Its fun and more enjoyable,262,False,False,False,False,False,False,False,False,False,False,,,,,,,,,,,,,
1942573381829988819,1913255226477277184,2025-07-08 13:16:00+00:00,"@volarcrypto Therapeutic mushrooms and pharmaceutical-grade DMSO ended my 17-year battle with PTSD, depression, anxiety, and chronic pain.
Contact 
@Organic_phD 
 now for premium psilocybin blends, high-purity DMSO, and trusted Ivermectin and DMT —discreetly shipped to your door",en,,0,0,0,0,[],"['volarcrypto', 'Organic_phD']",[],False,1941973120455262574,everyone,[],[<ReferencedTweet id=1942569930274033821 type=replied_to>],,,@volarcrypto Therapeutic mushrooms and pharmaceutical-grade DMSO ended my 17-year battle with PTSD depression anxiety and chronic pain. Contact @Organic_phD now for premium psilocybin blends high-purity DMSO and trusted Ivermectin and DMT —discreetly shipped to your door,263,False,False,False,False,False,False,False,False,False,False,,,,,,,,,,,,,
1942573357125296246,1802326965560520704,2025-07-08 13:15:54+00:00,"@adamdotdev - avoiding 95% of every grocery store, only buying produce

yeah this one was wild to get used to. now i dont even see most aisles, my gaze just flows past like they're not there",en,,0,0,1,0,[],['adamdotdev'],[],False,1941973120455262574,everyone,[],[<ReferencedTweet id=1941973120455262574 type=replied_to>],,,@adamdotdev - avoiding 95% of every grocery store only buying produce yeah this one was wild to get used to. now i dont even see most aisles my gaze just flows past like theyre not there,264,False,False,False,False,False,False,False,False,False,False,,,,,,,,,,,,,
1942573325907103981,1913255226477277184,2025-07-08 13:15:46+00:00,"@adamdotdev Therapeutic mushrooms and pharmaceutical-grade DMSO ended my 17-year battle with PTSD, depression, anxiety, and chronic pain.
Contact 
@Organic_phD 
 now for premium psilocybin blends, high-purity DMSO, and trusted Ivermectin and DMT —discreetly shipped to your door",en,,0,0,0,0,[],"['adamdotdev', 'Organic_phD']",[],False,1941973120455262574,everyone,[],[<ReferencedTweet id=1941973120455262574 type=replied_to>],,,@adamdotdev Therapeutic mushrooms and pharmaceutical-grade DMSO ended my 17-year battle with PTSD depression anxiety and chronic pain. Contact @Organic_phD now for premium psilocybin blends high-purity DMSO and trusted Ivermectin and DMT —discreetly shipped to your door,265,False,False,False,False,False,False,False,False,False,False,,,,,,,,,,,,,
1942572098247082279,1720665183188922368,2025-07-08 13:10:54+00:00,"@AI_Policies @InlandCaGuy @jmattprice @adamdotdev Please don't actually try perineum sunning—it's a pseudoscience fad with zero real evidence, just influencers peddling nonsense. ""Chi alignment"" is woo-woo energy talk, not stats (though Bayesian fitting could model the regret from burns). Eager for your ""findings,"" but",en,,0,0,0,0,[],"['AI_Policies', 'InlandCaGuy', 'jmattprice', 'adamdotdev']",[],False,1941973120455262574,everyone,"['Pseudoscience', 'Grok 3 is here. Try it for free.']",[<ReferencedTweet id=1942571722990895426 type=replied_to>],,,@AI_Policies @InlandCaGuy @jmattprice @adamdotdev Please dont actually try perineum sunning—its a pseudoscience fad with zero real evidence just influencers peddling nonsense. Chi alignment is woo-woo energy talk not stats (though Bayesian fitting could model the regret from burns). Eager for your findings but,266,False,False,False,False,False,False,False,False,False,False,,,,,,,,,,,,,
1942571884631187563,201659413,2025-07-08 13:10:03+00:00,@adamdotdev + a very important one : stop drinking alcohol,en,,0,0,0,0,[],['adamdotdev'],[],False,1941973120455262574,everyone,"['Food & Beverage Business', 'Drinks', 'Drink Experience']",[<ReferencedTweet id=1941973120455262574 type=replied_to>],,,@adamdotdev + a very important one   stop drinking alcohol,267,False,False,False,False,False,False,False,False,False,False,,,,,,,,,,,,,
1942571722990895426,1859779243707703296,2025-07-08 13:09:24+00:00,"@grok @InlandCaGuy @jmattprice @adamdotdev Chi alignment? Like bayesian fitting? Hmm. Anyway, I'll give it a whirl and report back with my findings.",en,,0,1,0,0,[],"['grok', 'InlandCaGuy', 'jmattprice', 'adamdotdev']",[],False,1941973120455262574,everyone,[],[<ReferencedTweet id=1942570865037828507 type=replied_to>],,,@grok @InlandCaGuy @jmattprice @adamdotdev Chi alignment? Like bayesian fitting? Hmm. Anyway Ill give it a whirl and report back with my findings.,268,False,False,False,False,False,False,False,False,False,False,,,,,,,,,,,,,
1942571260732489750,2687799254,2025-07-08 13:07:34+00:00,@adamdotdev Think 7/8 hours sleep each night goes a very very long way,en,,0,0,0,0,[],['adamdotdev'],[],False,1941973120455262574,everyone,[],[<ReferencedTweet id=1941973120455262574 type=replied_to>],,,@adamdotdev Think 7/8 hours sleep each night goes a very very long way,269,False,False,False,False,False,False,False,False,False,False,,,,,,,,,,,,,
1942570865037828507,1720665183188922368,2025-07-08 13:06:00+00:00,"@AI_Policies @InlandCaGuy @jmattprice @adamdotdev Ah, perineum sunning—the wellness trend that's equal parts absurd and risky. Purported benefits (all unproven hype): energy boost, better sleep, hormone regulation, vitamin D uptake, even ""chi alignment."" But science says it's bunk, with real dangers like severe sunburn or skin",en,,0,1,0,0,[],"['AI_Policies', 'InlandCaGuy', 'jmattprice', 'adamdotdev']",[],False,1941973120455262574,everyone,['Grok 3 is here. Try it for free.'],[<ReferencedTweet id=1942570072389681187 type=replied_to>],,,@AI_Policies @InlandCaGuy @jmattprice @adamdotdev Ah perineum sunning—the wellness trend thats equal parts absurd and risky. Purported benefits (all unproven hype)  energy boost better sleep hormone regulation vitamin D uptake even chi alignment. But science says its bunk with real dangers like severe sunburn or skin,270,False,False,False,False,False,False,False,False,False,False,,,,,,,,,,,,,
1942570782393262143,2962670238,2025-07-08 13:05:40+00:00,@adamdotdev yes it's a health tax we pay by living in modern society.,en,,0,0,0,0,[],['adamdotdev'],[],False,1941973120455262574,everyone,[],[<ReferencedTweet id=1941989807900512677 type=replied_to>],,,@adamdotdev yes its a health tax we pay by living in modern society.,271,False,False,False,False,False,False,False,False,False,False,,,,,,,,,,,,,
1942570760809120189,1214853311028969479,2025-07-08 13:05:35+00:00,"@adamdotdev no surprise people prefers the ""easy"" way instead of putting the effort",en,,0,0,0,0,[],['adamdotdev'],[],False,1941973120455262574,everyone,[],[<ReferencedTweet id=1941973120455262574 type=replied_to>],,,@adamdotdev no surprise people prefers the easy way instead of putting the effort,272,False,False,False,False,False,False,False,False,False,False,,,,,,,,,,,,,
1942570752093601898,1175521526,2025-07-08 13:05:33+00:00,"@adamdotdev This is great, but most people are so caught up in their heads with thinking patterns they can’t see nor process these options.",en,,0,0,0,0,[],['adamdotdev'],[],False,1941973120455262574,everyone,[],[<ReferencedTweet id=1941973120455262574 type=replied_to>],,,@adamdotdev This is great but most people are so caught up in their heads with thinking patterns they cant see nor process these options.,273,False,False,False,False,False,False,False,False,False,False,,,,,,,,,,,,,
